title,description,image,subdescription
A Real Tiger cub,"A woman at the Bangkok airport had an unusual gift in her luggage: a sedated tiger cub hidden among her soft toys! Although it might be sweet to bring a stuffed animal as a gift, it's definitely not cool to smuggle a 2-month-old tiger cub into the airport!",https://myhealthgazette.com/wp-content/uploads/2022/05/image-5.jpeg,"Oh no! Airport workers spotted something suspicious during an X-ray screening - it looked like a live animal! This just shows how easy it is to smuggle wildlife, and why people should be more careful. If someone is bold enough to try and sneak a live tiger into an airport in their carry-on luggage, then they should know that they won't get away with it!"
A Pound of Cocaine Under a Toupee,"This 65-year-old Colombian man must have had an odd fashion sense - trying to hide a pound of cocaine worth 30,000 euros under a toupee! He was definitely acting suspicious on his trip from Bogota to Barcelona, Spain, and it was pretty clear why. Who knows what would have happened if he hadn't been caught!",https://myhealthgazette.com/wp-content/uploads/2022/05/image-4.jpeg,The police were drawn to the man due to two photos they saw.
Aren’t you enthused?,"Are you a fan of movie props? If so, you'll be excited to get your hands on this exact replica of Russell Crow's helmet from ""Gladiator"". Although helmets are allowed in both carry-on and checked luggage, the spikes on this helmet mean that it can't be taken on the plane. Enjoy getting your hands on a piece of movie history!",https://myhealthgazette.com/wp-content/uploads/2022/05/image-3.jpeg,"Thankfully, no other passengers were scared that the Roman army would take over the plane or that they'd have to battle wild animals for everyone else's entertainment."
Bees as a present,"When Grandma came to visit, the grandkids were excited to get some gifts. But instead of toys or clothes, Grandma gave them something they'd never expected - a jar of bees! To make sure Grandma could fly with her buzzing passengers, she had to check in with the airline to see if the TSA had any rules about flying with bugs.",https://myhealthgazette.com/wp-content/uploads/2022/05/image-2.jpeg,Everyone who was allergic to bees at the airport should have had an EpiPen on hand!
"Trinity, Redefined?","If you’re feeling anxious about your upcoming flight, why not try saying a calming prayer to God? It might help settle your nerves. Plus, other passengers probably won't be too keen on sitting near someone who's carrying a concealed blade in a cross.",https://myhealthgazette.com/wp-content/uploads/2022/05/image-1.jpeg,"We hope the traveler had a safe flight, even if they got in trouble for having sharp items in their carry-on! Remember, checked luggage is the only place for knives and scissors. Have a good trip!"
Firearm Bong,"Have you ever wondered just how high you can soar? Well, it all depends on whether you tried to bring your gun-shaped glass bong aboard an aircraft as a carry-on item. Unfortunately, the TSA doesn't search for drugs, but if they're ever discovered, the plane will be met with local law enforcement who will take away your bong.",https://myhealthgazette.com/wp-content/uploads/2022/05/image.jpeg,"TSA agents don't take kindly to weapon replicas when they show up in the security line. So if you're packing checked luggage, leave the real and fake explosives at home."
